{
  "summary": {
    "score": 0,
    "by_severity": {
      "critical": 14,
      "major": 12,
      "minor": 3
    },
    "resolved_count": 29,
    "needs_judgment_count": 2
  },
  "findings": [
    {
      "id": "f1",
      "rule": "font_size",
      "severity": "major",
      "location": "div.title (line 29)",
      "measured": 14.0,
      "threshold": 16,
      "axis": "low_light",
      "fix_hint": "raise font-size to >= 16px (18px for critical labels)"
    },
    {
      "id": "f2",
      "rule": "contrast",
      "severity": "critical",
      "location": "div.title (line 29)",
      "measured": 3.88,
      "threshold": 4.5,
      "axis": "glare",
      "fix_hint": "increase fg/bg contrast to >= 7.0:1 (currently 3.88:1)"
    },
    {
      "id": "f3",
      "rule": "font_size",
      "severity": "critical",
      "location": "div.meta (line 30)",
      "measured": 13.0,
      "threshold": 14,
      "axis": "low_light",
      "fix_hint": "raise font-size to >= 16px"
    },
    {
      "id": "f4",
      "rule": "font_size",
      "severity": "major",
      "location": "div.hero-title (line 34)",
      "measured": 14.0,
      "threshold": 16,
      "axis": "low_light",
      "fix_hint": "raise font-size to >= 16px (18px for critical labels)"
    },
    {
      "id": "f5",
      "rule": "font_size",
      "severity": "major",
      "location": "div.qty (line 38)",
      "measured": 14.0,
      "threshold": 16,
      "axis": "low_light",
      "fix_hint": "raise font-size to >= 16px (18px for critical labels)"
    },
    {
      "id": "f6",
      "rule": "contrast",
      "severity": "critical",
      "location": "div.qty (line 38)",
      "measured": 2.17,
      "threshold": 4.5,
      "axis": "glare",
      "fix_hint": "increase fg/bg contrast to >= 7.0:1 (currently 2.17:1)"
    },
    {
      "id": "f7",
      "rule": "color_only",
      "severity": "major",
      "location": "span.status (line 38)",
      "axis": "glare",
      "fix_hint": "add text/icon + shape; do not rely on color alone"
    },
    {
      "id": "f8",
      "rule": "font_size",
      "severity": "major",
      "location": "p (line 39)",
      "measured": 14.0,
      "threshold": 16,
      "axis": "low_light",
      "fix_hint": "raise font-size to >= 16px (18px for critical labels)"
    },
    {
      "id": "f9",
      "rule": "contrast",
      "severity": "major",
      "location": "p (line 39)",
      "measured": 5.49,
      "threshold": 7.0,
      "axis": "glare",
      "fix_hint": "raise contrast to >= 7.0:1 for glare"
    },
    {
      "id": "f10",
      "rule": "target_size",
      "severity": "critical",
      "location": "button.icon-btn (line 41)",
      "measured": 36.0,
      "threshold": 48,
      "axis": "gloves",
      "fix_hint": "enlarge target to >= 64px (gloves)"
    },
    {
      "id": "f11",
      "rule": "spacing",
      "severity": "minor",
      "location": "button.icon-btn (line 41)",
      "measured": 2.0,
      "threshold": 12,
      "axis": "gloves",
      "fix_hint": "increase gap to >= 12px between targets"
    },
    {
      "id": "f12",
      "rule": "target_size",
      "severity": "critical",
      "location": "button.icon-btn (line 42)",
      "measured": 36.0,
      "threshold": 48,
      "axis": "gloves",
      "fix_hint": "enlarge target to >= 64px (gloves)"
    },
    {
      "id": "f13",
      "rule": "icon_only",
      "severity": "major",
      "location": "button.icon-btn (line 42)",
      "axis": "glare",
      "fix_hint": "add a visible text label or aria-label"
    },
    {
      "id": "f14",
      "rule": "spacing",
      "severity": "minor",
      "location": "button.icon-btn (line 42)",
      "measured": 2.0,
      "threshold": 12,
      "axis": "gloves",
      "fix_hint": "increase gap to >= 12px between targets"
    },
    {
      "id": "f15",
      "rule": "target_size",
      "severity": "critical",
      "location": "button.icon-btn (line 43)",
      "measured": 36.0,
      "threshold": 48,
      "axis": "gloves",
      "fix_hint": "enlarge target to >= 64px (gloves)"
    },
    {
      "id": "f16",
      "rule": "icon_only",
      "severity": "major",
      "location": "button.icon-btn (line 43)",
      "axis": "glare",
      "fix_hint": "add a visible text label or aria-label"
    },
    {
      "id": "f17",
      "rule": "spacing",
      "severity": "minor",
      "location": "button.icon-btn (line 43)",
      "measured": 2.0,
      "threshold": 12,
      "axis": "gloves",
      "fix_hint": "increase gap to >= 12px between targets"
    },
    {
      "id": "f18",
      "rule": "font_size",
      "severity": "major",
      "location": "a.tab (line 48)",
      "measured": 14.0,
      "threshold": 16,
      "axis": "low_light",
      "fix_hint": "raise font-size to >= 16px (18px for critical labels)"
    },
    {
      "id": "f19",
      "rule": "contrast",
      "severity": "critical",
      "location": "a.tab (line 48)",
      "measured": 2.41,
      "threshold": 4.5,
      "axis": "glare",
      "fix_hint": "increase fg/bg contrast to >= 7.0:1 (currently 2.41:1)"
    },
    {
      "id": "f20",
      "rule": "target_size",
      "severity": "critical",
      "location": "a.tab (line 48)",
      "measured": 44.0,
      "threshold": 48,
      "axis": "gloves",
      "fix_hint": "enlarge target to >= 64px (gloves)"
    },
    {
      "id": "f21",
      "rule": "font_size",
      "severity": "major",
      "location": "a.tab (line 49)",
      "measured": 14.0,
      "threshold": 16,
      "axis": "low_light",
      "fix_hint": "raise font-size to >= 16px (18px for critical labels)"
    },
    {
      "id": "f22",
      "rule": "contrast",
      "severity": "critical",
      "location": "a.tab (line 49)",
      "measured": 2.41,
      "threshold": 4.5,
      "axis": "glare",
      "fix_hint": "increase fg/bg contrast to >= 7.0:1 (currently 2.41:1)"
    },
    {
      "id": "f23",
      "rule": "target_size",
      "severity": "critical",
      "location": "a.tab (line 49)",
      "measured": 44.0,
      "threshold": 48,
      "axis": "gloves",
      "fix_hint": "enlarge target to >= 64px (gloves)"
    },
    {
      "id": "f24",
      "rule": "font_size",
      "severity": "major",
      "location": "a.tab (line 50)",
      "measured": 14.0,
      "threshold": 16,
      "axis": "low_light",
      "fix_hint": "raise font-size to >= 16px (18px for critical labels)"
    },
    {
      "id": "f25",
      "rule": "contrast",
      "severity": "critical",
      "location": "a.tab (line 50)",
      "measured": 2.41,
      "threshold": 4.5,
      "axis": "glare",
      "fix_hint": "increase fg/bg contrast to >= 7.0:1 (currently 2.41:1)"
    },
    {
      "id": "f26",
      "rule": "target_size",
      "severity": "critical",
      "location": "a.tab (line 50)",
      "measured": 44.0,
      "threshold": 48,
      "axis": "gloves",
      "fix_hint": "enlarge target to >= 64px (gloves)"
    },
    {
      "id": "f27",
      "rule": "font_size",
      "severity": "major",
      "location": "button.primary (line 53)",
      "measured": 14.0,
      "threshold": 16,
      "axis": "low_light",
      "fix_hint": "raise font-size to >= 16px (18px for critical labels)"
    },
    {
      "id": "f28",
      "rule": "contrast",
      "severity": "critical",
      "location": "button.primary (line 53)",
      "measured": 3.4,
      "threshold": 4.5,
      "axis": "glare",
      "fix_hint": "increase fg/bg contrast to >= 7.0:1 (currently 3.4:1)"
    },
    {
      "id": "f29",
      "rule": "target_size",
      "severity": "critical",
      "location": "button.primary (line 53)",
      "measured": 44.0,
      "threshold": 48,
      "axis": "gloves",
      "fix_hint": "enlarge target to >= 64px (gloves)"
    }
  ],
  "needs_judgment": [
    {
      "reason": "css_var_unresolved",
      "location": "div.meta (line 30)"
    },
    {
      "reason": "bg_image",
      "location": "div.hero-title (line 34)"
    }
  ],
  "target": "inbound-inspection.html"
}
